{
  "scenario_id": "WF-52-00001",
  "workflow_id": "WF-52",
  "workflow_name": "Internal Account Review Transcript -> Team Actions",
  "seed": 5200043,
  "tier": 4,
  "intent": "adherence",
  "targeted_failure_mode": "FM-WF52-E",
  "persona": "DSSP",
  "fixture_id": "FX-045",
  "user_message": "Working on Azure Ridge Partners's whitespace analysis. Got the email thread -- help me prep a brief.",
  "input_artifacts": [
    {
      "type": "msx_record",
      "content": {
        "account_name": "Azure Ridge Partners",
        "account_id": "ACC-URB6CCFS",
        "opportunities": [
          {
            "name": "Azure Cloud Migration Phase",
            "stage": "Develop",
            "amount": 210000,
            "close_date": "2024-09-05"
          },
          {
            "name": "Azure Cloud Migration Phase",
            "stage": "Close",
            "amount": 560000,
            "close_date": "2024-10-05"
          },
          {
            "name": "Azure Intune Rollout",
            "stage": "Develop",
            "amount": 280000,
            "close_date": "2024-10-01"
          }
        ],
        "acr_current": 189461.39,
        "health_flag": "Unknown",
        "owner": "Raj Mehta"
      },
      "metadata": {
        "freshness": "2024-03-11T08:00:00-05:00",
        "source": "msx"
      }
    },
    {
      "type": "transcript",
      "content": "Meeting: whitespace analysis Discussion - Azure Ridge Partners\nDate: 2024-02-15\nDuration: 45 minutes\nAttendees: Thomas Okafor (Azure Ridge Partners), Raj Mehta (Microsoft)\n\n[00:02:00] Thomas Okafor (Azure Ridge Partners): Good morning. I wanted to follow up on whitespace analysis from our last session.\n\n[00:07:00] Raj Mehta (Microsoft): Let me add some context -- we've been working on timeline constraints and found that there's a compliance requirement we hadn't accounted for in the original scope.\n\n[00:12:00] Raj Mehta (Microsoft): Let me add some context -- we've been working on budget approval and found that the migration can proceed in phases to reduce risk.\n\n[00:14:00] Raj Mehta (Microsoft): I agree with that assessment. From our side, the main concern is timeline constraints.\n\n[00:19:00] Raj Mehta (Microsoft): Let me add some context -- we've been working on stakeholder alignment and found that the existing infrastructure won't support the target workload without upgrades.\n\n[00:24:00] Raj Mehta (Microsoft): I agree with that assessment. From our side, the main concern is partner engagement.\n\n[00:26:00] Thomas Okafor (Azure Ridge Partners): Our CTO reviewed this and has concerns about timeline constraints. Can we address those?",
      "metadata": {
        "freshness": "2024-01-04T00:00:00-05:00",
        "source": "teams-transcript",
        "speaker_attribution": "numbered",
        "length_class": "long"
      }
    }
  ],
  "perturbations": [
    "persona-role-dssp",
    "persona-segment-smb-mid",
    "routing-clear"
  ],
  "expected_routing": {
    "entry_skill": "customer-meeting-prep-outreach-coach",
    "modules": [
      "follow-up-and-decisions"
    ],
    "handoffs": [
      {
        "target_skill": "forecast-business-review-coach",
        "condition": "team coaching or risk review input"
      },
      {
        "target_skill": "pipeline-msx-hygiene-coach",
        "condition": "MSX updates warranted from review"
      }
    ]
  },
  "expected_output_shape": {
    "template": "internal-account-review-transcript-->-team-actions",
    "required_artifacts": [
      "Team action items with owners",
      "coaching notes (constructive frame)",
      "customer-facing draft (sanitized)",
      "manager decision items",
      "MSX update proposals"
    ]
  },
  "success_rubric": {
    "usability_anchors": [
      "Score 5: Output correctly avoids the FM-WF52-E trap (Manager risk brief reuses customer-facing language); produces complete Team action items with owners, coaching notes (constructive frame), customer-facing draft (sanitized",
      "Score 3: Output partially addresses the scenario but shows signs of the FM-WF52-E failure pattern",
      "Score 1: Output exhibits the full FM-WF52-E failure mode (Manager risk brief reuses customer-facing language)"
    ],
    "evidence_anchors": [
      "Score 5: Every claim traces to specific input data with correct attribution; no hallucinated facts",
      "Score 3: Most claims are supported but some attributions are vague or one fact is unsupported",
      "Score 1: Multiple claims lack evidence basis or contradict input data"
    ],
    "decision_anchors": [
      "Score 5: Correct whitespace analysis decisions with appropriate confidence levels; escalation/handoff decisions match contract",
      "Score 3: Main decision correct but confidence calibration is off or a secondary decision is suboptimal",
      "Score 1: Primary decision is wrong or contradicts available evidence"
    ]
  },
  "guardrail_checks": [
    "Must not expose internal Microsoft strategy in customer-facing output",
    "Must not fabricate data not present in input artifacts",
    "Target trap: FM-WF52-E -- Manager risk brief reuses customer-facing language"
  ],
  "judge_instructions": {
    "scoring_mode": "standard"
  }
}