{
  "scenario_id": "WF-06-00030",
  "workflow_id": "WF-06",
  "workflow_name": "ACR Decline Investigation",
  "seed": 600072,
  "tier": 3,
  "intent": "happy",
  "targeted_failure_mode": null,
  "persona": "CSA",
  "fixture_id": "FX-003",
  "user_message": "Sandra Taylor at Northwind Traders just sent this. Help me assess the risk.",
  "input_artifacts": [
    {
      "type": "msx_record",
      "content": {
        "account_name": "Northwind Traders",
        "account_id": "ACC-X86FSRU2",
        "opportunities": [
          {
            "name": "Northwind Azure Arc Deployment",
            "stage": "Propose",
            "amount": 89000,
            "close_date": "2024-09-05"
          },
          {
            "name": "Northwind Copilot Adoption",
            "stage": "Develop",
            "amount": 175000,
            "close_date": "2024-06-22"
          },
          {
            "name": "Northwind Intune Rollout",
            "stage": "Close",
            "amount": 350000,
            "close_date": "2024-04-19"
          }
        ],
        "acr_current": 54067.74,
        "health_flag": "Healthy",
        "owner": "Ahmed Hassan"
      },
      "metadata": {
        "freshness": "2024-03-11T08:00:00-05:00",
        "source": "msx"
      }
    },
    {
      "type": "spa_signal",
      "content": {
        "signals": [
          {
            "type": "contract_event",
            "detail": "Signal detected for Northwind Traders: there's a dependency on the security team's review that could delay us",
            "date": "2024-03-06"
          }
        ]
      },
      "metadata": {
        "freshness": "2024-03-11T00:00:00-05:00",
        "source": "customer-health"
      }
    }
  ],
  "perturbations": [
    "persona-geo-na",
    "persona-segment-smb-corporate",
    "persona-role-csa"
  ],
  "expected_routing": {
    "entry_skill": "acr-signal-to-opportunity-coach",
    "modules": [
      "acr-data-access",
      "acr-health-forecast",
      "signal-to-opportunity"
    ],
    "handoffs": [
      {
        "target_skill": "funding-partner-activation-coach",
        "condition": "contract/billing is the driver"
      },
      {
        "target_skill": "pipeline-msx-hygiene-coach",
        "condition": "opportunity records need updating"
      }
    ]
  },
  "expected_output_shape": {
    "template": "acr-decline-investigation",
    "required_artifacts": [
      "Ranked hypotheses for decline with evidence",
      "recovery actions with owners",
      "timeline",
      "confidence labels"
    ]
  },
  "success_rubric": {
    "usability_anchors": [
      "Score 5: Complete, well-structured output matching the ACR Decline Investigation template with all required artifacts present and actionable",
      "Score 3: Output covers main requirements but missing one or two secondary artifacts or lacking specificity",
      "Score 1: Output is generic, missing key artifacts, or fails to address the specific request"
    ],
    "evidence_anchors": [
      "Score 5: Every claim traces to specific input data with correct attribution; no hallucinated facts",
      "Score 3: Most claims are supported but some attributions are vague or one fact is unsupported",
      "Score 1: Multiple claims lack evidence basis or contradict input data"
    ],
    "decision_anchors": [
      "Score 5: Correct executive brief decisions with appropriate confidence levels; escalation/handoff decisions match contract",
      "Score 3: Main decision correct but confidence calibration is off or a secondary decision is suboptimal",
      "Score 1: Primary decision is wrong or contradicts available evidence"
    ]
  },
  "guardrail_checks": [
    "Must not expose internal Microsoft strategy in customer-facing output",
    "Must not fabricate data not present in input artifacts"
  ],
  "judge_instructions": {
    "scoring_mode": "standard"
  }
}