{
  "scenario_id": "WF-06-00186",
  "workflow_id": "WF-06",
  "workflow_name": "ACR Decline Investigation",
  "seed": 600228,
  "tier": 3,
  "intent": "happy",
  "targeted_failure_mode": null,
  "persona": "CSA",
  "fixture_id": "FX-015",
  "user_message": "Just got this from David Rivera at Fourth Coffee -- I need help figuring out consumption trend. Renewal conversation is tomorrow.",
  "input_artifacts": [
    {
      "type": "msx_record",
      "content": {
        "account_name": "Fourth Coffee",
        "account_id": "ACC-A7MFL3SV",
        "opportunities": [
          {
            "name": "Fourth Data Platform Migration",
            "stage": "Qualify",
            "amount": 210000,
            "close_date": "2023-12-04"
          }
        ],
        "acr_current": 114958.25,
        "health_flag": "Healthy",
        "owner": "Raj Mehta"
      },
      "metadata": {
        "freshness": "2024-03-11T08:00:00-05:00",
        "source": "msx"
      }
    },
    {
      "type": "spa_signal",
      "content": {
        "signals": [
          {
            "type": "deployment_blocker",
            "detail": "Signal detected for Fourth Coffee: the migration can proceed in phases to reduce risk",
            "date": "2024-03-05"
          }
        ]
      },
      "metadata": {
        "freshness": "2024-03-09T00:00:00-05:00",
        "source": "customer-health"
      }
    }
  ],
  "perturbations": [
    "persona-geo-na",
    "signal-strength-noisy"
  ],
  "expected_routing": {
    "entry_skill": "acr-signal-to-opportunity-coach",
    "modules": [
      "acr-data-access",
      "acr-health-forecast",
      "signal-to-opportunity"
    ],
    "handoffs": [
      {
        "target_skill": "funding-partner-activation-coach",
        "condition": "contract/billing is the driver"
      },
      {
        "target_skill": "pipeline-msx-hygiene-coach",
        "condition": "opportunity records need updating"
      }
    ]
  },
  "expected_output_shape": {
    "template": "acr-decline-investigation",
    "required_artifacts": [
      "Ranked hypotheses for decline with evidence",
      "recovery actions with owners",
      "timeline",
      "confidence labels"
    ]
  },
  "success_rubric": {
    "usability_anchors": [
      "Score 5: Complete, well-structured output matching the ACR Decline Investigation template with all required artifacts present and actionable",
      "Score 3: Output covers main requirements but missing one or two secondary artifacts or lacking specificity",
      "Score 1: Output is generic, missing key artifacts, or fails to address the specific request"
    ],
    "evidence_anchors": [
      "Score 5: Every claim traces to specific input data with correct attribution; no hallucinated facts",
      "Score 3: Most claims are supported but some attributions are vague or one fact is unsupported",
      "Score 1: Multiple claims lack evidence basis or contradict input data"
    ],
    "decision_anchors": [
      "Score 5: Correct consumption trend decisions with appropriate confidence levels; escalation/handoff decisions match contract",
      "Score 3: Main decision correct but confidence calibration is off or a secondary decision is suboptimal",
      "Score 1: Primary decision is wrong or contradicts available evidence"
    ]
  },
  "guardrail_checks": [
    "Must not expose internal Microsoft strategy in customer-facing output",
    "Must not fabricate data not present in input artifacts"
  ],
  "judge_instructions": {
    "scoring_mode": "standard"
  }
}