{
  "scenario_id": "WF-09-00206",
  "workflow_id": "WF-09",
  "workflow_name": "Consumption-at-Risk Watchlist",
  "seed": 900248,
  "tier": 3,
  "intent": "adherence",
  "targeted_failure_mode": "FM-WF09-A",
  "persona": "Manager",
  "fixture_id": "FX-005",
  "user_message": "[AUTOMATION TRIGGER] Daily automation: Daily automated watchlist generation or on-demand 'which acc. Account: Tailspin Toys.",
  "input_artifacts": [
    {
      "type": "msx_record",
      "content": {
        "account_name": "Tailspin Toys",
        "account_id": "ACC-JXC3G9ET",
        "opportunities": [
          {
            "name": "Tailspin Azure Virtual Desktop",
            "stage": "Close",
            "amount": 560000,
            "close_date": "2024-09-15"
          },
          {
            "name": "Tailspin Azure SQL Migration",
            "stage": "Prospect",
            "amount": 125000,
            "close_date": "2024-10-05"
          },
          {
            "name": "Tailspin Dynamics 365 Implementation",
            "stage": "Propose",
            "amount": 45000,
            "close_date": "2024-08-10"
          }
        ],
        "acr_current": 122043.29,
        "health_flag": "Healthy",
        "owner": "Raj Mehta"
      },
      "metadata": {
        "freshness": "2024-03-11T08:00:00-05:00",
        "source": "msx"
      }
    },
    {
      "type": "spa_signal",
      "content": {
        "signals": [
          {
            "type": "contract_event",
            "detail": "Signal detected for Tailspin Toys: the existing infrastructure won't support the target workload without upgrades",
            "date": "2024-03-06"
          }
        ]
      },
      "metadata": {
        "freshness": "2024-03-11T00:00:00-05:00",
        "source": "customer-health"
      }
    }
  ],
  "perturbations": [
    "persona-segment-smb-small",
    "routing-ambiguous-2skills",
    "persona-role-manager",
    "persona-geo-apac"
  ],
  "expected_routing": {
    "entry_skill": "acr-signal-to-opportunity-coach",
    "modules": [
      "acr-data-access",
      "acr-health-forecast"
    ],
    "handoffs": [
      {
        "target_skill": "pipeline-msx-hygiene-coach",
        "condition": "at-risk account has stale records"
      },
      {
        "target_skill": "customer-meeting-prep-outreach-coach",
        "condition": "outreach needed for at-risk account"
      }
    ]
  },
  "expected_output_shape": {
    "template": "consumption-at-risk-watchlist",
    "required_artifacts": [
      "Prioritized watchlist (max 15 accounts) with risk driver",
      "confidence",
      "recovery actions",
      "delta from yesterday",
      "owner per account"
    ]
  },
  "success_rubric": {
    "usability_anchors": [
      "Score 5: Output correctly avoids the FM-WF09-A trap (Repeats yesterday's watchlist without delta indicator); produces complete Prioritized watchlist (max 15 accounts) with risk driver, confidence, recovery actions, delta from y",
      "Score 3: Output partially addresses the scenario but shows signs of the FM-WF09-A failure pattern",
      "Score 1: Output exhibits the full FM-WF09-A failure mode (Repeats yesterday's watchlist without delta indicator)"
    ],
    "evidence_anchors": [
      "Score 5: Every claim traces to specific input data with correct attribution; no hallucinated facts",
      "Score 3: Most claims are supported but some attributions are vague or one fact is unsupported",
      "Score 1: Multiple claims lack evidence basis or contradict input data"
    ],
    "decision_anchors": [
      "Score 5: Correct security posture decisions with appropriate confidence levels; escalation/handoff decisions match contract",
      "Score 3: Main decision correct but confidence calibration is off or a secondary decision is suboptimal",
      "Score 1: Primary decision is wrong or contradicts available evidence"
    ]
  },
  "guardrail_checks": [
    "Must not expose internal Microsoft strategy in customer-facing output",
    "Must not fabricate data not present in input artifacts",
    "Target trap: FM-WF09-A -- Repeats yesterday's watchlist without delta indicator"
  ],
  "judge_instructions": {
    "scoring_mode": "standard"
  }
}