{
  "scenario_id": "WF-20-90550",
  "workflow_id": "WF-20",
  "workflow_name": "Workload Modernization Plan",
  "seed": 9900592,
  "tier": 3,
  "intent": "adherence",
  "targeted_failure_mode": null,
  "persona": "Manager",
  "fixture_id": "FX-043",
  "user_message": "Give me the manager view on this Pacific Northwest Outfitters email thread. ",
  "input_artifacts": [
    {
      "type": "msx_record",
      "content": {
        "account_name": "Pacific Northwest Outfitters",
        "account_id": "ACC-6SYIFEPT",
        "opportunities": [
          {
            "name": "Pacific Azure Arc Deployment",
            "stage": "Qualify",
            "amount": 45000,
            "close_date": "2024-04-15"
          },
          {
            "name": "Pacific M365 E5 Upsell",
            "stage": "Qualify",
            "amount": 560000,
            "close_date": "2024-11-15"
          }
        ],
        "acr_current": 81560.32,
        "health_flag": "Healthy",
        "owner": "Ahmed Hassan"
      },
      "metadata": {
        "freshness": "2024-03-11T08:00:00-05:00",
        "source": "msx"
      }
    },
    {
      "type": "spa_signal",
      "content": {
        "signals": [
          {
            "type": "deployment_blocker",
            "detail": "Signal detected for Pacific Northwest Outfitters: the migration can proceed in phases to reduce risk",
            "date": "2024-03-11"
          }
        ]
      },
      "metadata": {
        "freshness": "2024-03-10T00:00:00-05:00",
        "source": "customer-health"
      }
    }
  ],
  "perturbations": [
    "persona-geo-emea",
    "data-inconsistent",
    "signal-strength-faint",
    "persona-tenure-junior",
    "routing-ambiguous-3skills"
  ],
  "expected_routing": {
    "entry_skill": "solution-value-design-coach",
    "modules": [
      "migration-architecture",
      "solution-research"
    ],
    "handoffs": [
      {
        "target_skill": "funding-partner-activation-coach",
        "condition": "funding eligibility check needed"
      }
    ]
  },
  "expected_output_shape": {
    "template": "adversarial-routing-test",
    "required_artifacts": [
      "correct_routing_justification",
      "confusion_analysis"
    ]
  },
  "success_rubric": {
    "usability_anchors": [
      "Score 5: Correctly routes to primary workflow despite adversarial signals; output is complete",
      "Score 3: Routes correctly but output shows contamination from confusing signals",
      "Score 1: Misroutes to wrong workflow or produces irrelevant output"
    ],
    "evidence_anchors": [
      "Score 5: All evidence correctly attributed despite cross-workflow noise",
      "Score 3: Some evidence misattributed but core facts correct",
      "Score 1: Significant evidence confusion or hallucination"
    ],
    "decision_anchors": [
      "Score 5: Decision-making robust against adversarial perturbations",
      "Score 3: Primary decision correct but secondary decisions influenced by noise",
      "Score 1: Primary decision compromised by adversarial inputs"
    ]
  },
  "guardrail_checks": [
    "Must correctly identify primary workflow despite adversarial routing signals",
    "Must not hallucinate context from similar-sounding workflows",
    "Must not expose internal routing logic to user"
  ],
  "judge_instructions": {
    "scoring_mode": "standard"
  }
}