{
  "scenario_id": "WF-24-00080",
  "workflow_id": "WF-24",
  "workflow_name": "CST / Billing Lookup",
  "seed": 2400122,
  "tier": 1,
  "intent": "adherence",
  "targeted_failure_mode": "FM-WF24-D",
  "persona": "Manager",
  "fixture_id": "FX-003",
  "user_message": "How should I coach Ahmed Hassan on Northwind Traders? ",
  "input_artifacts": [
    {
      "type": "msx_record",
      "content": {
        "account_name": "Northwind Traders",
        "account_id": "ACC-X86FSRU2",
        "opportunities": [
          {
            "name": "Northwind Azure Arc Deployment",
            "stage": "Propose",
            "amount": 89000,
            "close_date": "2024-09-05"
          },
          {
            "name": "Northwind Copilot Adoption",
            "stage": "Develop",
            "amount": 175000,
            "close_date": "2024-06-22"
          },
          {
            "name": "Northwind Intune Rollout",
            "stage": "Close",
            "amount": 350000,
            "close_date": "2024-04-19"
          }
        ],
        "acr_current": 54067.74,
        "health_flag": "Healthy",
        "owner": "Ahmed Hassan"
      },
      "metadata": {
        "freshness": "2024-03-11T08:00:00-05:00",
        "source": "msx"
      }
    }
  ],
  "perturbations": [
    "signal-strength-noisy",
    "persona-segment-smb-corporate",
    "persona-role-manager"
  ],
  "expected_routing": {
    "entry_skill": "funding-partner-activation-coach",
    "modules": [
      "contract-billing-lookup"
    ]
  },
  "expected_output_shape": {
    "template": "cst-/-billing-lookup",
    "required_artifacts": [
      "Contract summary with freshness labels",
      "subscription type",
      "renewal date",
      "MACC state if applicable",
      "billing frequency"
    ]
  },
  "success_rubric": {
    "usability_anchors": [
      "Score 5: Output correctly avoids the FM-WF24-D trap (Proposes commercial action (out of scope read-only)); produces complete Contract summary with freshness labels, subscription type, renewal date, MACC state if applicable, b",
      "Score 3: Output partially addresses the scenario but shows signs of the FM-WF24-D failure pattern",
      "Score 1: Output exhibits the full FM-WF24-D failure mode (Proposes commercial action (out of scope read-only))"
    ],
    "evidence_anchors": [
      "Score 5: Every claim traces to specific input data with correct attribution; no hallucinated facts",
      "Score 3: Most claims are supported but some attributions are vague or one fact is unsupported",
      "Score 1: Multiple claims lack evidence basis or contradict input data"
    ],
    "decision_anchors": [
      "Score 5: Correct QBR preparation decisions with appropriate confidence levels; escalation/handoff decisions match contract",
      "Score 3: Main decision correct but confidence calibration is off or a secondary decision is suboptimal",
      "Score 1: Primary decision is wrong or contradicts available evidence"
    ]
  },
  "guardrail_checks": [
    "Must not expose internal Microsoft strategy in customer-facing output",
    "Must not fabricate data not present in input artifacts",
    "Target trap: FM-WF24-D -- Proposes commercial action (out of scope read-only)"
  ],
  "judge_instructions": {
    "scoring_mode": "standard"
  }
}