{
  "scenario_id": "WF-09-00064",
  "workflow_id": "WF-09",
  "workflow_name": "Consumption-at-Risk Watchlist",
  "seed": 900106,
  "tier": 3,
  "intent": "assumption-stress",
  "targeted_failure_mode": "FM-WF09-K",
  "persona": "DSSP",
  "fixture_id": "FX-021",
  "user_message": "[AUTOMATION TRIGGER] Daily automation: Daily automated watchlist generation or on-demand 'which acc. Account: Nod Publishers.",
  "input_artifacts": [
    {
      "type": "msx_record",
      "content": {
        "account_name": "Nod Publishers",
        "account_id": "ACC-BFJJI6LY",
        "opportunities": [
          {
            "name": "Nod Azure SQL Migration",
            "stage": "Close",
            "amount": 45000,
            "close_date": "2023-10-06"
          },
          {
            "name": "Nod Intune Rollout",
            "stage": "Develop",
            "amount": 560000,
            "close_date": "2024-12-16"
          }
        ],
        "acr_current": 111088.58,
        "health_flag": "At Risk",
        "owner": "Marcus Williams"
      },
      "metadata": {
        "freshness": "2024-03-11T08:00:00-05:00",
        "source": "msx"
      }
    },
    {
      "type": "spa_signal",
      "content": {
        "signals": [
          {
            "type": "deployment_blocker",
            "detail": "Signal detected for Nod Publishers: the current vendor contract has a 90-day exit clause we need to plan around",
            "date": "2024-03-08"
          }
        ]
      },
      "metadata": {
        "freshness": "2024-03-09T00:00:00-05:00",
        "source": "customer-health"
      }
    }
  ],
  "perturbations": [
    "persona-geo-apac",
    "routing-ambiguous-2skills",
    "persona-segment-smb-mid"
  ],
  "expected_routing": {
    "entry_skill": "acr-signal-to-opportunity-coach",
    "modules": [
      "acr-data-access",
      "acr-health-forecast"
    ],
    "handoffs": [
      {
        "target_skill": "pipeline-msx-hygiene-coach",
        "condition": "at-risk account has stale records"
      },
      {
        "target_skill": "customer-meeting-prep-outreach-coach",
        "condition": "outreach needed for at-risk account"
      }
    ]
  },
  "expected_output_shape": {
    "template": "consumption-at-risk-watchlist",
    "required_artifacts": [
      "Prioritized watchlist (max 15 accounts) with risk driver",
      "confidence",
      "recovery actions",
      "delta from yesterday",
      "owner per account"
    ]
  },
  "success_rubric": {
    "usability_anchors": [
      "Score 5: Output correctly avoids the FM-WF09-K trap (Daily cadence wastes value for stable accounts); produces complete Prioritized watchlist (max 15 accounts) with risk driver, confidence, recovery actions, delta from y",
      "Score 3: Output partially addresses the scenario but shows signs of the FM-WF09-K failure pattern",
      "Score 1: Output exhibits the full FM-WF09-K failure mode (Daily cadence wastes value for stable accounts)"
    ],
    "evidence_anchors": [
      "Score 5: Every claim traces to specific input data with correct attribution; no hallucinated facts",
      "Score 3: Most claims are supported but some attributions are vague or one fact is unsupported",
      "Score 1: Multiple claims lack evidence basis or contradict input data"
    ],
    "decision_anchors": [
      "Score 5: Correct pipeline hygiene decisions with appropriate confidence levels; escalation/handoff decisions match contract",
      "Score 3: Main decision correct but confidence calibration is off or a secondary decision is suboptimal",
      "Score 1: Primary decision is wrong or contradicts available evidence"
    ]
  },
  "guardrail_checks": [
    "Must not expose internal Microsoft strategy in customer-facing output",
    "Must not fabricate data not present in input artifacts",
    "Target trap: FM-WF09-K -- Daily cadence wastes value for stable accounts",
    "Guardrail axis scored neutrally -- focus on whether output served the user's actual need"
  ],
  "judge_instructions": {
    "scoring_mode": "guardrail-neutral"
  }
}