{
  "scenario_id": "WF-44-00072",
  "workflow_id": "WF-44",
  "workflow_name": "Technical Deep-Dive Transcript -> Architecture + Blockers",
  "seed": 4400114,
  "tier": 4,
  "intent": "adherence",
  "targeted_failure_mode": "FM-WF44-A",
  "persona": "CSA",
  "fixture_id": "FX-037",
  "user_message": "Can you work with me on renewal risk for Woodgrove Labs? I think there's an opportunity here but need to validate.",
  "input_artifacts": [
    {
      "type": "msx_record",
      "content": {
        "account_name": "Woodgrove Labs",
        "account_id": "ACC-WZHG8AQ3",
        "opportunities": [
          {
            "name": "Woodgrove Power Platform",
            "stage": "Qualify",
            "amount": 210000,
            "close_date": "2024-12-15"
          },
          {
            "name": "Woodgrove AKS Deployment",
            "stage": "Propose",
            "amount": 125000,
            "close_date": "2024-05-21"
          }
        ],
        "acr_current": 204547.55,
        "health_flag": "At Risk",
        "owner": "David Chen"
      },
      "metadata": {
        "freshness": "2024-03-11T08:00:00-05:00",
        "source": "msx"
      }
    },
    {
      "type": "transcript",
      "content": "Meeting: renewal risk Discussion - Woodgrove Labs\nDate: 2024-03-22\nDuration: 45 minutes\nAttendees: Robert Petrov (Woodgrove Labs), David Chen (Microsoft)\n\n[00:02:00] Robert Petrov (Woodgrove Labs): Good morning. I wanted to follow up on renewal risk from our last session.\n\n[00:08:00] David Chen (Microsoft): On the renewal risk front, we've made progress but there are still blockers around timeline constraints.\n\n[00:10:00] Robert Petrov (Woodgrove Labs): The timeline for security compliance is aggressive. We need to validate the assumptions.\n\n[00:13:00] Robert Petrov (Woodgrove Labs): Let me add some context -- we've been working on integration complexity and found that there's a dependency on the security team's review that could delay us.\n\n[00:16:00] David Chen (Microsoft): I agree with that assessment. From our side, the main concern is data residency.\n\n[00:19:00] Robert Petrov (Woodgrove Labs): On the renewal risk front, we've made progress but there are still blockers around stakeholder alignment.\n\n[00:22:00] David Chen (Microsoft): The timeline for partner engagement is aggressive. We need to validate the assumptions.\n\n[00:25:00] David Chen (Microsoft): The timeline for vendor dependencies is aggressive. We need to validate the assumptions.",
      "metadata": {
        "freshness": "2024-01-15T00:00:00-05:00",
        "source": "teams-transcript",
        "speaker_attribution": "mixed",
        "length_class": "short"
      }
    }
  ],
  "perturbations": [
    "persona-geo-na",
    "routing-ambiguous-2skills",
    "data-inconsistent",
    "persona-tenure-senior"
  ],
  "expected_routing": {
    "entry_skill": "customer-meeting-prep-outreach-coach",
    "modules": [
      "follow-up-and-decisions"
    ],
    "handoffs": [
      {
        "target_skill": "solution-value-design-coach",
        "condition": "architecture sketch needed from technical signals"
      }
    ]
  },
  "expected_output_shape": {
    "template": "technical-deep-dive-transcript-->-architecture-+-b",
    "required_artifacts": [
      "Architecture summary",
      "blocker inventory (tech/commercial/org)",
      "open questions",
      "sequencing recommendation",
      "specialist routing"
    ]
  },
  "success_rubric": {
    "usability_anchors": [
      "Score 5: Output correctly avoids the FM-WF44-A trap (Architecture summary states customer-environment facts that were assumed not con); produces complete Architecture summary, blocker inventory (tech/commercial/org), open questions, sequencing recommenda",
      "Score 3: Output partially addresses the scenario but shows signs of the FM-WF44-A failure pattern",
      "Score 1: Output exhibits the full FM-WF44-A failure mode (Architecture summary states customer-environment facts that were assumed not con)"
    ],
    "evidence_anchors": [
      "Score 5: Every claim traces to specific input data with correct attribution; no hallucinated facts",
      "Score 3: Most claims are supported but some attributions are vague or one fact is unsupported",
      "Score 1: Multiple claims lack evidence basis or contradict input data"
    ],
    "decision_anchors": [
      "Score 5: Correct renewal risk decisions with appropriate confidence levels; escalation/handoff decisions match contract",
      "Score 3: Main decision correct but confidence calibration is off or a secondary decision is suboptimal",
      "Score 1: Primary decision is wrong or contradicts available evidence"
    ]
  },
  "guardrail_checks": [
    "Must not expose internal Microsoft strategy in customer-facing output",
    "Must not fabricate data not present in input artifacts",
    "Target trap: FM-WF44-A -- Architecture summary states customer-environment facts that were assumed not con"
  ],
  "judge_instructions": {
    "scoring_mode": "standard"
  }
}