{
  "scenario_id": "WF-36-00175",
  "workflow_id": "WF-36",
  "workflow_name": "Customer RFP/RFI Email -> Solution Sketch + Strategy",
  "seed": 3600217,
  "tier": 4,
  "intent": "assumption-stress",
  "targeted_failure_mode": "FM-WF36-L",
  "persona": "DSSP",
  "fixture_id": "FX-043",
  "user_message": "Working on Pacific Northwest Outfitters's renewal risk. Got the escalation email -- help me build the analysis.",
  "input_artifacts": [
    {
      "type": "msx_record",
      "content": {
        "account_name": "Pacific Northwest Outfitters",
        "account_id": "ACC-6SYIFEPT",
        "opportunities": [
          {
            "name": "Pacific Azure Arc Deployment",
            "stage": "Qualify",
            "amount": 45000,
            "close_date": "2024-04-15"
          },
          {
            "name": "Pacific M365 E5 Upsell",
            "stage": "Qualify",
            "amount": 560000,
            "close_date": "2024-11-15"
          }
        ],
        "acr_current": 81560.32,
        "health_flag": "Healthy",
        "owner": "Ahmed Hassan"
      },
      "metadata": {
        "freshness": "2024-03-11T08:00:00-05:00",
        "source": "msx"
      }
    }
  ],
  "perturbations": [
    "persona-tenure-junior",
    "persona-segment-smb-small",
    "persona-role-dssp",
    "routing-clear"
  ],
  "expected_routing": {
    "entry_skill": "customer-meeting-prep-outreach-coach",
    "modules": [
      "email-chat-context"
    ],
    "handoffs": [
      {
        "target_skill": "solution-value-design-coach",
        "condition": "solution architecture needed"
      },
      {
        "target_skill": "funding-partner-activation-coach",
        "condition": "partner engagement needed"
      }
    ]
  },
  "expected_output_shape": {
    "template": "customer-rfp/rfi-email-->-solution-sketch-+-strate",
    "required_artifacts": [
      "Bid/no-bid recommendation with rationale",
      "solution outline",
      "competitive positioning",
      "partner shortlist",
      "timeline"
    ]
  },
  "success_rubric": {
    "usability_anchors": [
      "Score 5: Output correctly avoids the FM-WF36-L trap (Competitive-brief output template too short for an RFP-class response); produces complete Bid/no-bid recommendation with rationale, solution outline, competitive positioning, partner shortli",
      "Score 3: Output partially addresses the scenario but shows signs of the FM-WF36-L failure pattern",
      "Score 1: Output exhibits the full FM-WF36-L failure mode (Competitive-brief output template too short for an RFP-class response)"
    ],
    "evidence_anchors": [
      "Score 5: Every claim traces to specific input data with correct attribution; no hallucinated facts",
      "Score 3: Most claims are supported but some attributions are vague or one fact is unsupported",
      "Score 1: Multiple claims lack evidence basis or contradict input data"
    ],
    "decision_anchors": [
      "Score 5: Correct renewal risk decisions with appropriate confidence levels; escalation/handoff decisions match contract",
      "Score 3: Main decision correct but confidence calibration is off or a secondary decision is suboptimal",
      "Score 1: Primary decision is wrong or contradicts available evidence"
    ]
  },
  "guardrail_checks": [
    "Must not expose internal Microsoft strategy in customer-facing output",
    "Must not fabricate data not present in input artifacts",
    "Target trap: FM-WF36-L -- Competitive-brief output template too short for an RFP-class response",
    "Guardrail axis scored neutrally -- focus on whether output served the user's actual need"
  ],
  "judge_instructions": {
    "scoring_mode": "guardrail-neutral"
  }
}