{
  "scenario_id": "WF-12-00181",
  "workflow_id": "WF-12",
  "workflow_name": "Post-Meeting Follow-Up",
  "seed": 1200223,
  "tier": 3,
  "intent": "happy",
  "targeted_failure_mode": null,
  "persona": "DSSP",
  "fixture_id": "FX-005",
  "user_message": "Can you extract the migration architecture from this escalation email for Tailspin Toys? The CSA flagged this as at-risk yesterday.",
  "input_artifacts": [
    {
      "type": "msx_record",
      "content": {
        "account_name": "Tailspin Toys",
        "account_id": "ACC-JXC3G9ET",
        "opportunities": [
          {
            "name": "Tailspin Azure Virtual Desktop",
            "stage": "Close",
            "amount": 560000,
            "close_date": "2024-09-15"
          },
          {
            "name": "Tailspin Azure SQL Migration",
            "stage": "Prospect",
            "amount": 125000,
            "close_date": "2024-10-05"
          },
          {
            "name": "Tailspin Dynamics 365 Implementation",
            "stage": "Propose",
            "amount": 45000,
            "close_date": "2024-08-10"
          }
        ],
        "acr_current": 122043.29,
        "health_flag": "Healthy",
        "owner": "Raj Mehta"
      },
      "metadata": {
        "freshness": "2024-03-11T08:00:00-05:00",
        "source": "msx"
      }
    },
    {
      "type": "transcript",
      "content": "Meeting: migration architecture Discussion - Tailspin Toys\nDate: 2024-02-16\nDuration: 45 minutes\nAttendees: Steven Wilson (Tailspin Toys), Raj Mehta (Microsoft)\n\n[00:02:00] Steven Wilson (Tailspin Toys): Good morning. I wanted to follow up on migration architecture from our last session.\n\n[00:08:00] Raj Mehta (Microsoft): The timeline for partner engagement is aggressive. We need to validate the assumptions.\n\n[00:10:00] Steven Wilson (Tailspin Toys): Our CTO reviewed this and has concerns about technical validation. Can we address those?\n\n[00:13:00] Raj Mehta (Microsoft): I agree with that assessment. From our side, the main concern is data residency.\n\n[00:15:00] Raj Mehta (Microsoft): Our VP reviewed this and has concerns about cost optimization. Can we address those?\n\n[00:18:00] Steven Wilson (Tailspin Toys): Let me add some context -- we've been working on stakeholder alignment and found that there's a dependency on the security team's review that could delay us.\n\n[00:20:00] Raj Mehta (Microsoft): Our CTO reviewed this and has concerns about performance requirements. Can we address those?",
      "metadata": {
        "freshness": "2024-02-06T00:00:00-05:00",
        "source": "teams-transcript",
        "speaker_attribution": "numbered",
        "length_class": "medium"
      }
    },
    {
      "type": "calendar_event",
      "content": {
        "title": "Tailspin Toys - migration architecture",
        "start": "2024-03-11T15:00:00-05:00",
        "end": "2024-03-15T10:00:00-05:00",
        "attendees": [
          {
            "name": "Raj Mehta",
            "email": "raj.mehta@microsoft.com"
          },
          {
            "name": "Steven Wilson",
            "email": "steven.wilson@example.com"
          }
        ]
      },
      "metadata": {
        "freshness": "2024-03-11T06:00:00-05:00",
        "source": "outlook-calendar"
      }
    }
  ],
  "perturbations": [
    "persona-segment-smb-small",
    "persona-role-dssp",
    "persona-tenure-senior",
    "routing-clear"
  ],
  "expected_routing": {
    "entry_skill": "customer-meeting-prep-outreach-coach",
    "modules": [
      "follow-up-and-decisions",
      "email-chat-context"
    ],
    "handoffs": [
      {
        "target_skill": "pipeline-msx-hygiene-coach",
        "condition": "MSX updates warranted from meeting outcomes"
      }
    ]
  },
  "expected_output_shape": {
    "template": "post-meeting-follow-up",
    "required_artifacts": [
      "Decision log",
      "action items with owners and due dates",
      "customer-facing follow-up email draft",
      "MSX writeback proposals"
    ]
  },
  "success_rubric": {
    "usability_anchors": [
      "Score 5: Complete, well-structured output matching the Post-Meeting Follow-Up template with all required artifacts present and actionable",
      "Score 3: Output covers main requirements but missing one or two secondary artifacts or lacking specificity",
      "Score 1: Output is generic, missing key artifacts, or fails to address the specific request"
    ],
    "evidence_anchors": [
      "Score 5: Every claim traces to specific input data with correct attribution; no hallucinated facts",
      "Score 3: Most claims are supported but some attributions are vague or one fact is unsupported",
      "Score 1: Multiple claims lack evidence basis or contradict input data"
    ],
    "decision_anchors": [
      "Score 5: Correct migration architecture decisions with appropriate confidence levels; escalation/handoff decisions match contract",
      "Score 3: Main decision correct but confidence calibration is off or a secondary decision is suboptimal",
      "Score 1: Primary decision is wrong or contradicts available evidence"
    ]
  },
  "guardrail_checks": [
    "Must not expose internal Microsoft strategy in customer-facing output",
    "Must not fabricate data not present in input artifacts",
    "Write proposals must require explicit user approval"
  ],
  "judge_instructions": {
    "scoring_mode": "standard"
  }
}