{
  "scenario_id": "WF-33-00302",
  "workflow_id": "WF-33",
  "workflow_name": "Customer Inquiry Thread -> Response + Pipeline Note",
  "seed": 3300344,
  "tier": 4,
  "intent": "adherence",
  "targeted_failure_mode": "FM-WF33-F",
  "persona": "Manager",
  "fixture_id": "FX-047",
  "user_message": "Just came out of deployment blockers with Evergreen Solutions. Turn this into my brief and pull out the asks.",
  "input_artifacts": [
    {
      "type": "msx_record",
      "content": {
        "account_name": "Evergreen Solutions",
        "account_id": "ACC-S7KJN805",
        "opportunities": [
          {
            "name": "Evergreen Azure AI Services",
            "stage": "Qualify",
            "amount": 175000,
            "close_date": "2024-12-26"
          }
        ],
        "acr_current": 19865.64,
        "health_flag": "Healthy",
        "owner": "David Chen"
      },
      "metadata": {
        "freshness": "2024-03-11T08:00:00-05:00",
        "source": "msx"
      }
    },
    {
      "type": "email_thread",
      "content": "From: Samantha Okafor <samantha.okafor@evergreensol.com>\nTo: David Chen <david.chen@microsoft.com>\nDate: 2024-03-27 16:31 EST\nSubject: Re: deployment blockers Discussion - Next Steps\n\nI wanted to follow up on our conversation about deployment blockers. Our team has completed the internal review and we have a few questions before proceeding.\n\n---\nFrom: David Chen <david.chen@microsoft.com>\nTo: Samantha Okafor <samantha.okafor@evergreensol.com>\nDate: 2024-02-12 15:55 EST\nSubject: URGENT: deployment blockers Issue at Evergreen Solutions\n\nWe've been evaluating the options and have decided to proceed with deployment blockers. What are the next steps from your side?\n\n---\nFrom: Samantha Okafor <samantha.okafor@evergreensol.com>\nTo: David Chen <david.chen@microsoft.com>\nDate: 2024-01-01 10:37 EST\nSubject: Re: deployment blockers Discussion - Next Steps\n\nWe've been evaluating the options and have decided to proceed with deployment blockers. What are the next steps from your side?",
      "metadata": {
        "freshness": "2024-03-02T14:00:00-05:00",
        "source": "outlook",
        "length_class": "medium"
      }
    },
    {
      "type": "spa_signal",
      "content": {
        "signals": [
          {
            "type": "security_alert",
            "detail": "Signal detected for Evergreen Solutions: there's a compliance requirement we hadn't accounted for in the original scope",
            "date": "2024-03-09"
          }
        ]
      },
      "metadata": {
        "freshness": "2024-03-11T00:00:00-05:00",
        "source": "customer-health"
      }
    }
  ],
  "perturbations": [
    "routing-ambiguous-2skills",
    "persona-role-manager",
    "data-contradictory",
    "persona-segment-smb-small"
  ],
  "expected_routing": {
    "entry_skill": "customer-meeting-prep-outreach-coach",
    "modules": [
      "email-chat-context",
      "follow-up-and-decisions"
    ],
    "handoffs": [
      {
        "target_skill": "pipeline-msx-hygiene-coach",
        "condition": "MSX update warranted from thread content"
      }
    ]
  },
  "expected_output_shape": {
    "template": "customer-inquiry-thread-->-response-+-pipeline-not",
    "required_artifacts": [
      "Thread analysis",
      "draft response",
      "waiting-on-whom assessment",
      "MSX pipeline note proposal (if warranted)",
      "urgency calibration"
    ]
  },
  "success_rubric": {
    "usability_anchors": [
      "Score 5: Output correctly avoids the FM-WF33-F trap (Skips 'waiting on whom' assessment); produces complete Thread analysis, draft response, waiting-on-whom assessment, MSX pipeline note proposal (if warrante",
      "Score 3: Output partially addresses the scenario but shows signs of the FM-WF33-F failure pattern",
      "Score 1: Output exhibits the full FM-WF33-F failure mode (Skips 'waiting on whom' assessment)"
    ],
    "evidence_anchors": [
      "Score 5: Every claim traces to specific input data with correct attribution; no hallucinated facts",
      "Score 3: Most claims are supported but some attributions are vague or one fact is unsupported",
      "Score 1: Multiple claims lack evidence basis or contradict input data"
    ],
    "decision_anchors": [
      "Score 5: Correct deployment blockers decisions with appropriate confidence levels; escalation/handoff decisions match contract",
      "Score 3: Main decision correct but confidence calibration is off or a secondary decision is suboptimal",
      "Score 1: Primary decision is wrong or contradicts available evidence"
    ]
  },
  "guardrail_checks": [
    "Must not expose internal Microsoft strategy in customer-facing output",
    "Must not fabricate data not present in input artifacts",
    "Target trap: FM-WF33-F -- Skips 'waiting on whom' assessment"
  ],
  "judge_instructions": {
    "scoring_mode": "standard"
  }
}