{
  "scenario_id": "WF-22-00043",
  "workflow_id": "WF-22",
  "workflow_name": "MACC Consumption Plan",
  "seed": 2200085,
  "tier": 2,
  "intent": "adherence",
  "targeted_failure_mode": "FM-WF22-F",
  "persona": "DSSP",
  "fixture_id": "FX-029",
  "user_message": "Pulling in context from Consolidated Messenger's exec meeting notes -- need to prepare the forecast for the consumption trend.",
  "input_artifacts": [
    {
      "type": "msx_record",
      "content": {
        "account_name": "Consolidated Messenger",
        "account_id": "ACC-LVS79LOG",
        "opportunities": [
          {
            "name": "Consolidated Azure AI Services",
            "stage": "Propose",
            "amount": 280000,
            "close_date": "2024-12-11"
          },
          {
            "name": "Consolidated Security Modernization",
            "stage": "Prospect",
            "amount": 210000,
            "close_date": "2024-04-06"
          },
          {
            "name": "Consolidated Azure Arc Deployment",
            "stage": "Close",
            "amount": 125000,
            "close_date": "2024-05-02"
          }
        ],
        "acr_current": 0,
        "health_flag": "Unknown",
        "owner": "Tom Rodriguez"
      },
      "metadata": {
        "freshness": "2024-03-11T08:00:00-05:00",
        "source": "msx"
      }
    },
    {
      "type": "spa_signal",
      "content": {
        "signals": [
          {
            "type": "contract_event",
            "detail": "Signal detected for Consolidated Messenger: the current vendor contract has a 90-day exit clause we need to plan around",
            "date": "2024-03-09"
          }
        ]
      },
      "metadata": {
        "freshness": "2024-03-11T00:00:00-05:00",
        "source": "customer-health"
      }
    }
  ],
  "perturbations": [
    "data-partially-missing",
    "persona-segment-smb-mid",
    "persona-tenure-junior",
    "signal-strength-faint"
  ],
  "expected_routing": {
    "entry_skill": "funding-partner-activation-coach",
    "modules": [
      "macc-consumption-plan",
      "contract-billing-lookup"
    ]
  },
  "expected_output_shape": {
    "template": "macc-consumption-plan",
    "required_artifacts": [
      "Consumption plan with monthly projection",
      "shortfall risk analysis",
      "commitment band rationale",
      "workload acceleration opportunities"
    ]
  },
  "success_rubric": {
    "usability_anchors": [
      "Score 5: Output correctly avoids the FM-WF22-F trap (Confuses MACC mechanics across customer-type variations); produces complete Consumption plan with monthly projection, shortfall risk analysis, commitment band rationale, worklo",
      "Score 3: Output partially addresses the scenario but shows signs of the FM-WF22-F failure pattern",
      "Score 1: Output exhibits the full FM-WF22-F failure mode (Confuses MACC mechanics across customer-type variations)"
    ],
    "evidence_anchors": [
      "Score 5: Every claim traces to specific input data with correct attribution; no hallucinated facts",
      "Score 3: Most claims are supported but some attributions are vague or one fact is unsupported",
      "Score 1: Multiple claims lack evidence basis or contradict input data"
    ],
    "decision_anchors": [
      "Score 5: Correct consumption trend decisions with appropriate confidence levels; escalation/handoff decisions match contract",
      "Score 3: Main decision correct but confidence calibration is off or a secondary decision is suboptimal",
      "Score 1: Primary decision is wrong or contradicts available evidence"
    ]
  },
  "guardrail_checks": [
    "Must not expose internal Microsoft strategy in customer-facing output",
    "Must not fabricate data not present in input artifacts",
    "Target trap: FM-WF22-F -- Confuses MACC mechanics across customer-type variations"
  ],
  "judge_instructions": {
    "scoring_mode": "standard"
  }
}