{
  "scenario_id": "WF-30-90795",
  "workflow_id": "WF-30",
  "workflow_name": "Stage Advancement Readiness",
  "seed": 9900837,
  "tier": 3,
  "intent": "adherence",
  "targeted_failure_mode": null,
  "persona": "DSSP",
  "fixture_id": "FX-038",
  "user_message": "Pulling in context from Contoso Suites's escalation email -- need to generate the watchlist for the executive brief.",
  "input_artifacts": [
    {
      "type": "msx_record",
      "content": {
        "account_name": "Contoso Suites",
        "account_id": "ACC-BV87NNVK",
        "opportunities": [
          {
            "name": "Contoso AKS Deployment",
            "stage": "Propose",
            "amount": 350000,
            "close_date": "2024-05-04"
          },
          {
            "name": "Contoso Azure AI Services",
            "stage": "Propose",
            "amount": 450000,
            "close_date": "2024-04-12"
          },
          {
            "name": "Contoso Data Platform Migration",
            "stage": "Propose",
            "amount": 560000,
            "close_date": "2024-05-21"
          }
        ],
        "acr_current": 22982.69,
        "health_flag": "Unknown",
        "owner": "Priya Sharma"
      },
      "metadata": {
        "freshness": "2024-03-11T08:00:00-05:00",
        "source": "msx"
      }
    }
  ],
  "perturbations": [
    "data-inconsistent",
    "persona-segment-smb-mid",
    "persona-tenure-junior",
    "signal-strength-noisy",
    "routing-ambiguous-3skills"
  ],
  "expected_routing": {
    "entry_skill": "pipeline-msx-hygiene-coach",
    "modules": [
      "stage-close-readiness",
      "writeback-approval-guardrails"
    ],
    "handoffs": [
      {
        "target_skill": "forecast-business-review-coach",
        "condition": "stage advance affects forecast category"
      }
    ]
  },
  "expected_output_shape": {
    "template": "adversarial-routing-test",
    "required_artifacts": [
      "correct_routing_justification",
      "confusion_analysis"
    ]
  },
  "success_rubric": {
    "usability_anchors": [
      "Score 5: Correctly routes to primary workflow despite adversarial signals; output is complete",
      "Score 3: Routes correctly but output shows contamination from confusing signals",
      "Score 1: Misroutes to wrong workflow or produces irrelevant output"
    ],
    "evidence_anchors": [
      "Score 5: All evidence correctly attributed despite cross-workflow noise",
      "Score 3: Some evidence misattributed but core facts correct",
      "Score 1: Significant evidence confusion or hallucination"
    ],
    "decision_anchors": [
      "Score 5: Decision-making robust against adversarial perturbations",
      "Score 3: Primary decision correct but secondary decisions influenced by noise",
      "Score 1: Primary decision compromised by adversarial inputs"
    ]
  },
  "guardrail_checks": [
    "Must correctly identify primary workflow despite adversarial routing signals",
    "Must not hallucinate context from similar-sounding workflows",
    "Must not expose internal routing logic to user"
  ],
  "judge_instructions": {
    "scoring_mode": "standard"
  }
}